[{"id":"artikel-genus.01","concept":"artikel-genus","level":"A1","kind":"choose-article","task":"Write the definite article.","prompt":"___ Zeitung","answer":["die"],"note":"Nouns in -ung are feminine.","strict_case":false,"topic":"gender-caps","focus":["article"],"strict":["die"],"wrong":["der","das"],"rule":"Nouns ending in -ung are feminine: die Zeitung."},{"id":"artikel-genus.02","concept":"artikel-genus","level":"A1","kind":"choose-article","task":"Write the definite article.","prompt":"___ Fenster","answer":["das"],"note":"das Fenster: learn the article with the noun.","strict_case":false,"topic":"gender-caps","focus":["article"],"strict":["das"],"wrong":["der","die"],"rule":"Fenster is neuter: das Fenster."},{"id":"artikel-genus.03","concept":"artikel-genus","level":"A1","kind":"choose-article","task":"Write the definite article.","prompt":"___ Löffel","answer":["der"],"note":"der Löffel, die Gabel, das Messer.","strict_case":false,"topic":"gender-caps","focus":["article"],"strict":["der"],"wrong":["die","das"],"rule":"Löffel is masculine: der Löffel, die Gabel, das Messer."},{"id":"artikel-genus.04","concept":"artikel-genus","level":"A1","kind":"choose-article","task":"Write the definite article.","prompt":"___ Mädchen","answer":["das"],"note":"Nouns in -chen are always neuter.","strict_case":false,"topic":"gender-caps","focus":["article"],"strict":["das"],"wrong":["die"],"rule":"Nouns ending in -chen are neuter: das Mädchen."},{"id":"artikel-genus.05","concept":"artikel-genus","level":"A1","kind":"choose-article","task":"Write the definite article.","prompt":"___ Wohnung","answer":["die"],"note":"Nouns in -ung are feminine.","strict_case":false,"topic":"gender-caps","focus":["article"],"strict":["die"],"wrong":["der","das"],"rule":"Nouns ending in -ung are feminine: die Wohnung."},{"id":"artikel-genus.06","concept":"artikel-genus","level":"A1","kind":"choose-article","task":"Write the definite article.","prompt":"___ Kühlschrank","answer":["der"],"note":"Compound nouns take the gender of the last part: der Schrank.","strict_case":false,"topic":"gender-caps","focus":["article"],"strict":["der"],"wrong":["das","die"],"rule":"Compound nouns take the gender of the last part: der Schrank, der Kühlschrank."},{"id":"artikel-genus.07","concept":"artikel-genus","level":"A1","kind":"choose-article","task":"Write the definite article.","prompt":"___ Freiheit","answer":["die"],"note":"Nouns in -heit and -keit are feminine.","strict_case":false,"topic":"gender-caps","focus":["article"],"strict":["die"],"wrong":["das","der"],"rule":"Nouns ending in -heit and -keit are feminine: die Freiheit."},{"id":"artikel-genus.08","concept":"artikel-genus","level":"A1","kind":"choose-article","task":"Write the definite article.","prompt":"___ Brötchen","answer":["das"],"note":"Nouns in -chen are always neuter.","strict_case":false,"topic":"gender-caps","focus":["article"],"strict":["das"],"wrong":["der","die"],"rule":"Nouns ending in -chen are neuter: das Brötchen."},{"id":"artikel-genus.09","concept":"artikel-genus","level":"A1","kind":"choose-article","task":"Write the definite article.","prompt":"___ Montag","answer":["der"],"note":"Days of the week are masculine.","strict_case":false,"topic":"gender-caps","focus":["article"],"strict":["der"],"wrong":["das","die"],"rule":"Days of the week are masculine: der Montag."},{"id":"artikel-genus.10","concept":"artikel-genus","level":"A1","kind":"translate","task":"Translate into German, with the article.","prompt":"the kitchen","answer":["die Küche"],"note":"die Küche.","strict_case":false,"topic":"gender-caps","focus":["article","cap"],"strict":["die","Küche"],"wrong":["der Küche","das Küche","die küche"],"rule":"Küche is feminine: die Küche."},{"id":"hauptsatz-verbzweit.01","concept":"hauptsatz-verbzweit","level":"A1","kind":"transform","task":"Rewrite the sentence starting with „Heute“.","prompt":"Ich gehe heute ins Kino.","answer":["Heute gehe ich ins Kino."],"note":"The verb stays in position 2; the subject moves after it.","strict_case":false,"topic":"v2","trap":"v2","focus":["v2"],"wrong":["Heute ich gehe ins Kino.","Heute, ich gehe ins Kino."],"rule":"After Heute, the verb comes next, then the subject: Heute gehe ich ins Kino."},{"id":"hauptsatz-verbzweit.02","concept":"hauptsatz-verbzweit","level":"A1","kind":"transform","task":"Rewrite the sentence starting with „Am Abend“.","prompt":"Wir essen am Abend Pizza.","answer":["Am Abend essen wir Pizza."],"note":"Am Abend fills position 1; essen stays second.","strict_case":false,"topic":"v2","trap":"v2","focus":["v2"],"wrong":["Am Abend wir essen Pizza."],"rule":"After Am Abend, the verb comes next, then the subject: Am Abend essen wir Pizza."},{"id":"hauptsatz-verbzweit.03","concept":"hauptsatz-verbzweit","level":"A1","kind":"order","task":"Put the words in order. Start with „Morgen“.","prompt":"ich / arbeite / morgen / nicht","answer":["Morgen arbeite ich nicht."],"note":"Time first, then verb, then subject.","strict_case":false,"topic":"v2","trap":"v2","focus":["v2"],"wrong":["Morgen ich arbeite nicht."],"rule":"After Morgen, the verb comes next, then the subject: Morgen arbeite ich nicht."},{"id":"hauptsatz-verbzweit.04","concept":"hauptsatz-verbzweit","level":"A1","kind":"order","task":"Put the words in order. Start with „Am Wochenende“.","prompt":"besuchen / wir / am Wochenende / unsere Eltern","answer":["Am Wochenende besuchen wir unsere Eltern."],"note":"A phrase in position 1 counts as one element.","strict_case":false,"topic":"v2","trap":"v2","focus":["v2"],"wrong":["Am Wochenende wir besuchen unsere Eltern."],"rule":"After Am Wochenende, the verb comes next, then the subject: Am Wochenende besuchen wir unsere Eltern."},{"id":"hauptsatz-verbzweit.05","concept":"hauptsatz-verbzweit","level":"A1","kind":"transform","task":"Rewrite the sentence starting with „Morgens“.","prompt":"Er trinkt morgens Kaffee.","answer":["Morgens trinkt er Kaffee."],"note":"Verb second, subject third.","strict_case":false,"topic":"v2","trap":"v2","focus":["v2"],"wrong":["Morgens er trinkt Kaffee."],"rule":"After Morgens, the verb comes next, then the subject: Morgens trinkt er Kaffee."},{"id":"hauptsatz-verbzweit.06","concept":"hauptsatz-verbzweit","level":"A1","kind":"order","task":"Put the words in order. Start with „In Berlin“.","prompt":"sie / seit zwei Jahren / wohnt / in Berlin","answer":["In Berlin wohnt sie seit zwei Jahren."],"note":"Place in position 1, verb in position 2.","strict_case":false,"topic":"v2","trap":"v2","focus":["v2"],"wrong":["In Berlin sie wohnt seit zwei Jahren."],"rule":"After In Berlin, the verb comes next, then the subject: In Berlin wohnt sie seit zwei Jahren."},{"id":"hauptsatz-verbzweit.07","concept":"hauptsatz-verbzweit","level":"A1","kind":"transform","task":"Rewrite the sentence starting with „Leider“.","prompt":"Ich habe keine Zeit.","answer":["Leider habe ich keine Zeit."],"note":"Leider takes position 1, so the subject follows the verb.","strict_case":false,"topic":"v2","trap":"v2","focus":["v2"],"wrong":["Leider, ich habe keine Zeit.","Leider ich habe keine Zeit."],"rule":"After Leider, the verb comes next, then the subject: Leider habe ich keine Zeit."},{"id":"hauptsatz-verbzweit.08","concept":"hauptsatz-verbzweit","level":"A1","kind":"order","task":"Put the words in order. Start with „Um acht Uhr“.","prompt":"der Kurs / beginnt / um acht Uhr","answer":["Um acht Uhr beginnt der Kurs."],"note":"Verb second, subject after it.","strict_case":false,"topic":"v2","trap":"v2","focus":["v2"],"wrong":["Um acht Uhr der Kurs beginnt."],"rule":"After Um acht Uhr, the verb comes next, then the subject: Um acht Uhr beginnt der Kurs."},{"id":"hauptsatz-verbzweit.09","concept":"hauptsatz-verbzweit","level":"A1","kind":"translate","task":"Translate into German. Start with „Heute“.","prompt":"Today I am staying at home.","answer":["Heute bleibe ich zu Hause.","Heute bleibe ich zuhause.","Heute bleibe ich daheim."],"note":"Heute bleibe ich: verb second.","strict_case":false,"topic":"v2","trap":"v2","focus":["v2"],"wrong":["Heute ich bleibe zu Hause."],"rule":"After Heute, the verb comes next, then the subject: Heute bleibe ich zu Hause."},{"id":"hauptsatz-verbzweit.10","concept":"hauptsatz-verbzweit","level":"A1","kind":"transform","task":"Rewrite the sentence starting with „Im Sommer“.","prompt":"Wir fahren im Sommer nach Hamburg.","answer":["Im Sommer fahren wir nach Hamburg."],"note":"Verb second, subject third.","strict_case":false,"topic":"v2","trap":"v2","focus":["v2"],"wrong":["Im Sommer wir fahren nach Hamburg."],"rule":"After Im Sommer, the verb comes next, then the subject: Im Sommer fahren wir nach Hamburg."},{"id":"hauptsatz-verbzweit.11","concept":"hauptsatz-verbzweit","level":"A1","kind":"order","task":"Put the words in order. Start with „Dann“.","prompt":"ich / einen Tee / trinke / dann","answer":["Dann trinke ich einen Tee."],"note":"dann in position 1, verb second.","strict_case":false,"topic":"v2","trap":"v2","focus":["v2"],"wrong":["Dann ich trinke einen Tee."],"rule":"After Dann, the verb comes next, then the subject: Dann trinke ich einen Tee."},{"id":"hauptsatz-verbzweit.12","concept":"hauptsatz-verbzweit","level":"A1","kind":"transform","task":"Rewrite the sentence starting with „Später“.","prompt":"Mein Bruder kommt später.","answer":["Später kommt mein Bruder."],"note":"The subject moves behind the verb.","strict_case":false,"topic":"v2","trap":"v2","focus":["v2"],"wrong":["Später mein Bruder kommt."],"rule":"After Später, the verb comes next, then the subject: Später kommt mein Bruder."},{"id":"noun-capitalization.01","concept":"noun-capitalization","level":"A1","kind":"transform","task":"Rewrite with correct capital letters.","prompt":"ich habe heute keine zeit.","answer":["Ich habe heute keine Zeit."],"note":"All nouns are capitalized: die Zeit.","strict_case":true,"topic":"gender-caps","trap":"cap","focus":["cap"],"strict":["Zeit"],"wrong":["Ich habe heute keine zeit."],"rule":"Nouns take a